<?xml version='1.0' encoding='UTF-8' ?>
<!DOCTYPE Report SYSTEM "ReportDefinition.dtd">
<Report>
  <Report_Body>
    <Report_Title Title = "Tubing Line List"/>
    <Report_StyleSheet Path = "C:\Documents and Settings\IPA\Desktop\"/>
    <Report_Attribute Field_Name = "Name                   " Field_Type = "attribute" Field_Label = "Name                    " Field_Operation = "none"/>
    <Report_Attribute Field_Name = "ClassName" Field_Type = "attribute" Field_Label = "Class Name" Field_Operation = "none"/>
    <Report_Attribute Field_Name = "NominalSize            " Field_Type = "attribute" Field_Label = "Nominal Size            " Field_Operation = "none"/>
    <Report_Attribute Field_Name = "TubeSpecification      " Field_Type = "attribute" Field_Label = "Tube Specification      " Field_Operation = "none"/>
    <Report_Attribute Field_Name = "CommodityType          " Field_Type = "attribute" Field_Label = "Commodity Type          " Field_Operation = "none"/>
    <Report_Attribute Field_Name = "DesignTemperature      " Field_Type = "attribute" Field_Label = "Design Temperature      " Field_Operation = "none"/>
    <Report_Attribute Field_Name = "DesignPressure         " Field_Type = "attribute" Field_Label = "Design Pressure         " Field_Operation = "none"/>
    <Report_Attribute Field_Name = "InsulationSpecification" Field_Type = "attribute" Field_Label = "Insulation Specification" Field_Operation = "none"/>
    <Report_Attribute Field_Name = "InsulationThickness    " Field_Type = "attribute" Field_Label = "Insulation Thickness    " Field_Operation = "none"/>
    <Report_Attribute Field_Name = "FromToTable            " Field_Type = "attribute" Field_Label = "From To Table           " Field_Operation = "none"/>
  </Report_Body>
  <Report_Support>
    <Report_Query Query_Name = "All Tubing Lines" Query_Text = "'Tubing Design'.'Tubing Line',all"/>
    <Report_V5_Environment Object_Type = "TubingLine    "/>
    <Report_V5_Environment Object_Type = "TubingLine"/>
    <Report_V5_Environment Object_Type = "TubingLine    "/>
    <Report_V5_Environment Object_Type = "TubingPartFunc"/>
    <Report_V5_Environment Object_Type = "TubingLine    "/>
    <Report_V5_Environment Object_Type = "TubingLine    "/>
    <Report_V5_Environment Object_Type = "TubingLine    "/>
    <Report_V5_Environment Object_Type = "TubingLine    "/>
    <Report_V5_Environment Object_Type = "TubingLine    "/>
    <Report_V5_Environment Object_Type = "TubingLine    "/>
  </Report_Support>
</Report>
