<?xml version='1.0' encoding='UTF-8' ?>
<!DOCTYPE Report SYSTEM "ReportDefinition.dtd">
<Report>
  <Report_Body>
    <Report_Title Title = "Pipe Cut Length Report"/>
    <Report_StyleSheet Path = "C:\Documents and Settings\IPA\Desktop\"/>
    <Report_Attribute Field_Name = "Name                " Field_Sort = "yes" Field_Type = "attribute" Field_Label = "Name                   " Field_Operation = "none"/>
    <Report_Attribute Field_Name = "PartNumber          " Field_Type = "attribute" Field_Label = "Part Number            " Field_Operation = "group_by"/>
    <Report_Attribute Field_Name = "PartName" Field_Type = "attribute" Field_Label = "Part Name" Field_Operation = "none"/>
    <Report_Attribute Field_Name = "NominalSize         " Field_Type = "attribute" Field_Label = "Nominal Size           " Field_Operation = "none"/>
    <Report_Attribute Field_Name = "MaterialCategory    " Field_Type = "attribute" Field_Label = "Material Category      " Field_Operation = "none"/>
    <Report_Attribute Field_Name = "MaterialCode        " Field_Type = "attribute" Field_Label = "Material Code          " Field_Operation = "none"/>
    <Report_Attribute Field_Name = "ParentPipingLineName" Field_Type = "attribute" Field_Label = "Parent Piping Line Name" Field_Operation = "none"/>
    <Report_Attribute Field_Name = "PipeLength          " Field_Type = "attribute" Field_Label = "Pipe Length            " Field_Operation = "sum"/>
    <Report_Attribute Field_Name = "_Quantity_" Field_Type = "system" Field_Label = "_Quantity_             " Field_Operation = "none"/>
  </Report_Body>
  <Report_Support>
    <Report_Query Query_Name = "All Piping Pipes 17" Query_Text = "'Piping Design'.Pipes,all"/>
    <Report_V5_Environment Object_Type = "PipingPipe      "/>
    <Report_V5_Environment Object_Type = "PipingPipe      "/>
    <Report_V5_Environment Object_Type = "PipingPipe"/>
    <Report_V5_Environment Object_Type = "PipingPipe      "/>
    <Report_V5_Environment Object_Type = "PipingPipe      "/>
    <Report_V5_Environment Object_Type = "PipingPipe      "/>
    <Report_V5_Environment Object_Type = "PipingPipe      "/>
    <Report_V5_Environment Object_Type = "PipingPipe      "/>
    <Report_V5_Environment Object_Type = "AnalysisSolution"/>
  </Report_Support>
</Report>
